{"$schema":"https://json-schema.org/draft/2020-12/schema","$id":"https://buildinpublicuniversity.com/humain-api/schemas/resolve-request.v1.json","title":"HumAIn Resolve Request v1","type":"object","required":["schema","message_id","pointer","requester","audience","action","nonce","created_at","capabilities","signature"],"properties":{"schema":{"const":"humain.resolve.request.v1"},"message_id":{"type":"string","minLength":1},"pointer":{"type":"string","format":"uri","pattern":"^https?://"},"requester":{"type":"string","minLength":1},"audience":{"type":"string","minLength":1},"action":{"type":"string","minLength":1},"nonce":{"type":"string","minLength":8},"created_at":{"type":"string","format":"date-time"},"capabilities":{"type":"array","items":{"$ref":"#/$defs/capability"}},"signature":{"$ref":"#/$defs/signature"}},"$defs":{"capability":{"type":"object","required":["capability_id","issuer","subject","audience","pointer","action","issued_at","expires_at","revoked"],"properties":{"capability_id":{"type":"string"},"issuer":{"type":"string"},"subject":{"type":"string"},"audience":{"type":"string"},"pointer":{"type":"string","format":"uri"},"action":{"type":"string"},"issued_at":{"type":"string","format":"date-time"},"expires_at":{"type":"string","format":"date-time"},"revoked":{"type":"boolean"}},"additionalProperties":false},"signature":{"type":"object","required":["algorithm","key_ref","value"],"properties":{"algorithm":{"type":"string"},"key_ref":{"type":"string"},"value":{"type":"string"}},"additionalProperties":false}}}