{
  "schema": "humain.resolve.request.v1",
  "message_id": "request:example-1",
  "pointer": "https://example.com/article/123",
  "requester": "did:key:z6MkAgent",
  "audience": "did:key:z6MkPublisher",
  "action": "resolve",
  "nonce": "example-nonce-1",
  "created_at": "2026-08-10T00:00:00Z",
  "capabilities": [{"capability_id":"cap:example-1","issuer":"did:key:z6MkPublisher","subject":"did:key:z6MkAgent","audience":"did:key:z6MkPublisher","pointer":"https://example.com/article/123","action":"resolve","issued_at":"2026-08-09T00:00:00Z","expires_at":"2026-08-11T00:00:00Z","revoked":false}],
  "signature": {"algorithm":"demo","key_ref":"did:key:z6MkAgent","value":"demo:unsigned"}
}
